{
  "artifact_class": "exp001-comparative-qwen-download-authorization",
  "authorization_id": "exp001-qwen3-download-v1",
  "status": "operator_authorized",
  "operator_id": "MarcoPorcellato",
  "model_id": "Qwen/Qwen3-0.6B-Base",
  "revision": "da87bfb608c14b7cf20ba1ce41287e8de496c0cd",
  "license_id": "Apache-2.0",
  "runtime_root": "artifacts/models/qwen3-0.6b-base-da87bfb",
  "disk_budget_bytes": 1610612736,
  "runtime_files": [
    {"path": "config.json", "size_bytes": 727, "source_oid": "43c79dcb3766612b23cbed17d0a56ce63efe4e74", "source_kind": "git_blob"},
    {"path": "generation_config.json", "size_bytes": 138, "source_oid": "cbbb3133034e192527e5321b4c679154e4819ab8", "source_kind": "git_blob"},
    {"path": "merges.txt", "size_bytes": 1671853, "source_oid": "31349551d90c7606f325fe0f11bbb8bd5fa0d7c7", "source_kind": "git_blob"},
    {"path": "model.safetensors", "size_bytes": 1192135096, "source_oid": "cd2a512003e2f9f3cd3c32a9c3573f820bb28c940f73c57b1ddaa983d9223eba", "source_kind": "lfs_sha256"},
    {"path": "tokenizer.json", "size_bytes": 7031645, "source_oid": "443909a61d429dff23010e5bddd28ff530edda00", "source_kind": "git_blob"},
    {"path": "tokenizer_config.json", "size_bytes": 9678, "source_oid": "6a3829ee9491f36113e64df37573be81df0366f5", "source_kind": "git_blob"},
    {"path": "vocab.json", "size_bytes": 2776833, "source_oid": "4783fe10ac3adce15ac8f358ef5462739852c569", "source_kind": "git_blob"}
  ],
  "permissions": {
    "download_runtime_files_only": true,
    "integrity_receipt": true,
    "model_load": false,
    "feasibility": false,
    "sealed_execution": false,
    "sealed_targets": false
  },
  "authorization_text_sha256": "operator-approved-exact-qwen-seven-file-download-and-integrity-only",
  "source_tree_url": "https://huggingface.co/Qwen/Qwen3-0.6B-Base/tree/da87bfb608c14b7cf20ba1ce41287e8de496c0cd"
}
